{
  "schemaVersion": 1,
  "benchmarkVersion": 1,
  "benchmarkId": "sentinel-todo",
  "caseId": "A",
  "runMode": "case",
  "sentinelSha": "e7e5289dcc7f9e9cebf035e5962be989ee1db046",
  "productionProfileId": "production-v1",
  "status": "BLOCKED",
  "finalExecutionState": null,
  "specClosed": false,
  "finalTestsPassed": true,
  "decomposition": {
    "slices": 0,
    "tasks": 0,
    "tasksPerSlice": {}
  },
  "operations": {
    "total": 2,
    "reviewPlanRounds": 0,
    "reviewTasksRounds": 0,
    "replans": 0,
    "executeCalls": 0,
    "validateCalls": 0,
    "applyFindingsCalls": 0,
    "findingsCycles": 0,
    "mechanicalRejections": 1,
    "retries": 1
  },
  "modelUse": {
    "expectedProfile": {
      "SPEC": {
        "model": "GPT-5.6-Terra",
        "effort": "high"
      },
      "PLAN": {
        "model": "GPT-5.6-Terra",
        "effort": "high"
      },
      "TASKS": {
        "model": "GPT-5.6-Terra",
        "effort": "high"
      },
      "EXECUTE": {
        "model": "GPT-5.6-Luna",
        "effort": "high"
      },
      "REVIEW_VALIDATE": {
        "model": "GPT-5.6-Luna",
        "effort": "high"
      }
    },
    "actualModelsByPhase": {
      "SPEC": [
        "GPT-5.6-Terra",
        "GPT-5.6-Luna"
      ],
      "PLAN": [],
      "TASKS": [],
      "EXECUTE": [],
      "REVIEW_VALIDATE": []
    },
    "actualEffortsByPhase": {
      "SPEC": [
        "high"
      ],
      "PLAN": [],
      "TASKS": [],
      "EXECUTE": [],
      "REVIEW_VALIDATE": []
    },
    "childDispatches": [],
    "profileMismatches": [
      {
        "eventIndex": 2,
        "operation": "SPEC_READINESS",
        "phase": "SPEC",
        "expectedModel": "GPT-5.6-Terra",
        "actualModel": "GPT-5.6-Luna",
        "expectedEffort": "high",
        "actualEffort": "high"
      }
    ],
    "solEscalations": 0
  },
  "contextCost": {
    "planBytes": 0,
    "planWords": 0,
    "tasksBytes": 0,
    "tasksWords": 0,
    "handoffBytes": null,
    "observableReads": null,
    "actualTokenTelemetryAvailable": false,
    "inputTokens": null,
    "outputTokens": null
  },
  "workspace": {
    "changedFileCount": 9,
    "finalDiffBytes": 12865,
    "seedContentHash": "sha256:9d93fbfa52b2e20607452f43d0ecb21e74f1872bb7a2da1b94dc2c814e7552e8",
    "requirementsHash": "sha256:5ceb3ce5210e3cb13e185edb8f9b0d3bc3e13b88575e494e42d92c0118456426",
    "requirementsHashMatches": true,
    "observedSentinelSha": "e7e5289dcc7f9e9cebf035e5962be989ee1db046",
    "sentinelShaMatchesCheckout": true
  },
  "finalTests": {
    "command": "node --test",
    "exitCode": 0,
    "passed": true
  }
}
