{
  "schemaVersion": 1,
  "benchmarkVersion": 1,
  "benchmarkId": "sentinel-todo",
  "caseId": "A",
  "runMode": "case",
  "sentinelSha": "81e0258295c8e6b57e85d81f083c47f76469fda8",
  "productionProfileId": "production-v1",
  "status": "BLOCKED",
  "finalExecutionState": "EMPTY",
  "specClosed": false,
  "finalTestsPassed": true,
  "decomposition": {
    "slices": 0,
    "tasks": 0,
    "tasksPerSlice": {}
  },
  "operations": {
    "total": 2,
    "reviewPlanRounds": 0,
    "reviewTasksRounds": 0,
    "replans": 0,
    "executeCalls": 0,
    "validateCalls": 0,
    "applyFindingsCalls": 0,
    "findingsCycles": 0,
    "mechanicalRejections": 0,
    "retries": 0
  },
  "modelUse": {
    "expectedProfile": {
      "SPEC": {
        "model": "GPT-5.6-Terra",
        "effort": "high"
      },
      "PLAN": {
        "model": "GPT-5.6-Terra",
        "effort": "high"
      },
      "TASKS": {
        "model": "GPT-5.6-Terra",
        "effort": "high"
      },
      "EXECUTE": {
        "model": "GPT-5.6-Luna",
        "effort": "high"
      },
      "REVIEW_VALIDATE": {
        "model": "GPT-5.6-Luna",
        "effort": "high"
      }
    },
    "actualModelsByPhase": {
      "SPEC": [
        "GPT-5.6-Terra"
      ],
      "PLAN": [],
      "TASKS": [],
      "EXECUTE": [],
      "REVIEW_VALIDATE": [
        "GPT-5.6-Luna"
      ]
    },
    "actualEffortsByPhase": {
      "SPEC": [
        "high"
      ],
      "PLAN": [],
      "TASKS": [],
      "EXECUTE": [],
      "REVIEW_VALIDATE": [
        "high"
      ]
    },
    "childDispatches": [],
    "profileMismatches": [],
    "solEscalations": 0
  },
  "contextCost": {
    "planBytes": 0,
    "planWords": 0,
    "tasksBytes": 0,
    "tasksWords": 0,
    "handoffBytes": null,
    "observableReads": null,
    "actualTokenTelemetryAvailable": false,
    "inputTokens": null,
    "outputTokens": null
  },
  "workspace": {
    "changedFileCount": 4,
    "finalDiffBytes": 6562,
    "seedContentHash": "sha256:9d93fbfa52b2e20607452f43d0ecb21e74f1872bb7a2da1b94dc2c814e7552e8",
    "requirementsHash": "sha256:e5934bc22267756c3c10b31c46b7a9cd894b78e961b11975b0f14f7085349a24",
    "requirementsHashMatches": true,
    "observedSentinelSha": "81e0258295c8e6b57e85d81f083c47f76469fda8",
    "sentinelShaMatchesCheckout": true
  },
  "finalTests": {
    "command": "node --test",
    "exitCode": 0,
    "passed": true
  }
}
